{
  "models": [
    {
      "name": "logistic_regression",
      "library": "scikit-learn",
      "hyperparameters": {
        "C": 0.1
      },
      "cv_score": 0.56452,
      "cv_score_std": 0.06138,
      "train_time_seconds": 0.1,
      "artifact_path": "outputs/model/model.joblib"
    },
    {
      "name": "lightgbm",
      "library": "lightgbm",
      "hyperparameters": {
        "n_estimators": 200,
        "learning_rate": 0.05,
        "num_leaves": 15,
        "min_child_samples": 50
      },
      "cv_score": 0.51355,
      "cv_score_std": 0.08341,
      "train_time_seconds": 0.2,
      "artifact_path": "outputs/model/model_lightgbm.joblib"
    }
  ],
  "selected_model": "logistic_regression",
  "selection_rationale": "Paired per-fold comparison, simplest first; a more complex family must beat the incumbent by more than the std of the per-fold gap. lightgbm vs logistic_regression: -0.0510 +/- 0.1042 per fold [-0.2142, 0.0088, -0.0252, 0.0888, -0.113] -> keep logistic_regression. Selected logistic_regression. Features: 12 of 15 raw after selection.",
  "primary_metric": "pr_auc",
  "cv_strategy": "5-fold expanding-window TimeSeriesSplit on time-sorted train (entities can appear on both sides of a fold boundary, as they do across train/test)",
  "training_script": "work/train.py",
  "model_artifact_path": "outputs/model/model.joblib",
  "random_seed": 42,
  "notes": "Feature selection: work/feature_selection.py -> outputs/model/feature_selection.json (rule 'mean', redundancy removed []). Winner's validation-fold predictions: outputs/model/cv_predictions.parquet (for choosing a threshold without test). Winner CV: roc_auc 0.9800, precision_at_top_1pct 0.5615, recall_at_top_1pct 0.4774. Test split not used."
}